<?xml version="1.0" encoding="utf-8"?>
<!-- Created with Liquid XML Studio - FREE Community Edition 7.0.5.906 (http://www.liquid-technologies.com) -->
<Catalog xmlns:xsi="http://www.w3.org/2001/XMLSchema-instance" xsi:noNamespaceSchemaLocation="file:///C:/Documents%20and%20Settings/Michele/Documenti/SharpDevelop%20Projects/mkdb/wxprops.xsd" Name="string" Base="string">
  <Category Name="string">
    <Property Name="string">
      <Value>string</Value>
      <Description>string</Description>
      <TypeConverter>string</TypeConverter>
    </Property>
    <Property Name="string">
      <Value>string</Value>
      <Description>string</Description>
      <TypeConverter>string</TypeConverter>
    </Property>
  </Category>
</Catalog>